{
  "$schema": "https://json-schema.org/draft/2020-12/schema",
  "$id": "https://schemas.shadertools.dev/shadertools.schema.json",
  "title": "Shader Tools workspace settings",
  "description": "Project settings sent to shader-language-server. Project values override user settings; objects merge and arrays replace.",
  "type": "object",
  "additionalProperties": false,
  "properties": {
    "$schema": {
      "type": "string",
      "description": "Optional schema URL or relative schema path for JSON editor support."
    },
    "validate": {
      "type": "boolean",
      "default": true,
      "description": "Run compiler validation while editing."
    },
    "symbols": {
      "type": "boolean",
      "default": true,
      "description": "Enable language features backed by shader symbols."
    },
    "symbolDiagnostics": {
      "type": "boolean",
      "default": false,
      "description": "Show internal symbol analysis diagnostics. Usually useful only when debugging the language server."
    },
    "validateConfig": {
      "type": "boolean",
      "default": true,
      "description": "Ask the language server to validate referenced paths and compiler combinations."
    },
    "automaticVariantDiscovery": {
      "type": "boolean",
      "default": false,
      "description": "Reuse a dependent main-file context when an include file is analyzed."
    },
    "experimentalMacroExpansion": {
      "type": "boolean",
      "default": false,
      "description": "Include experimental macro expansion in symbol analysis."
    },
    "severity": {
      "type": "string",
      "enum": ["none", "error", "warning", "info", "hint"],
      "default": "info",
      "description": "Lowest compiler diagnostic severity shown by the editor."
    },
    "includes": {
      "type": "array",
      "items": { "type": "string" },
      "default": [],
      "description": "Include directories. Relative paths use the directory containing this settings file."
    },
    "defines": {
      "type": "object",
      "additionalProperties": { "type": "string" },
      "default": {},
      "description": "Global preprocessor symbols. Values must be strings, including numeric-looking values."
    },
    "pathRemapping": {
      "type": "object",
      "additionalProperties": { "type": "string" },
      "default": {},
      "description": "Maps virtual include prefixes to directories. Target values are resolved relative to this settings file."
    },
    "stageDefine": {
      "type": "object",
      "additionalProperties": false,
      "default": {},
      "description": "Preprocessor symbols added for a specific shader stage.",
      "properties": {
        "vertex": { "$ref": "#/$defs/defines" },
        "fragment": { "$ref": "#/$defs/defines" },
        "compute": { "$ref": "#/$defs/defines" },
        "tesselationControl": { "$ref": "#/$defs/defines" },
        "tesselationEvaluation": { "$ref": "#/$defs/defines" },
        "mesh": { "$ref": "#/$defs/defines" },
        "task": { "$ref": "#/$defs/defines" },
        "geometry": { "$ref": "#/$defs/defines" },
        "rayGeneration": { "$ref": "#/$defs/defines" },
        "closestHit": { "$ref": "#/$defs/defines" },
        "anyHit": { "$ref": "#/$defs/defines" },
        "callable": { "$ref": "#/$defs/defines" },
        "miss": { "$ref": "#/$defs/defines" },
        "intersect": { "$ref": "#/$defs/defines" }
      }
    },
    "trace": {
      "type": "object",
      "additionalProperties": false,
      "properties": {
        "server": {
          "type": "string",
          "enum": ["off", "messages", "verbose"],
          "default": "off",
          "description": "Language-server protocol trace detail."
        }
      }
    },
    "configOverride": {
      "type": "string",
      "default": "",
      "description": "Optional shader-language-server override JSON file, resolved relative to this settings file."
    },
    "glsl": {
      "type": "object",
      "additionalProperties": false,
      "properties": {
        "targetClient": {
          "type": "string",
          "enum": ["None", "Vulkan1_0", "Vulkan1_1", "Vulkan1_2", "Vulkan1_3", "OpenGL450"],
          "default": "Vulkan1_3",
          "description": "GLSL client environment used for compilation."
        },
        "spirvVersion": {
          "type": "string",
          "enum": ["None", "SPIRV1_0", "SPIRV1_1", "SPIRV1_2", "SPIRV1_3", "SPIRV1_4", "SPIRV1_5", "SPIRV1_6"],
          "default": "SPIRV1_6",
          "description": "SPIR-V version targeted by GLSL compilation."
        },
        "preamble": {
          "type": "string",
          "default": "",
          "description": "Optional file prepended to every GLSL shader, resolved relative to this settings file."
        }
      }
    },
    "hlsl": {
      "type": "object",
      "additionalProperties": false,
      "properties": {
        "shaderModel": {
          "type": "string",
          "enum": [
            "ShaderModel6", "ShaderModel6_1", "ShaderModel6_2", "ShaderModel6_3",
            "ShaderModel6_4", "ShaderModel6_5", "ShaderModel6_6", "ShaderModel6_7",
            "ShaderModel6_8"
          ],
          "default": "ShaderModel6_8",
          "description": "DXC shader model."
        },
        "version": {
          "type": "string",
          "enum": ["V2016", "V2017", "V2018", "V2021"],
          "default": "V2021",
          "description": "HLSL language version."
        },
        "enable16bitTypes": {
          "type": "boolean",
          "default": false,
          "description": "Enable native 16-bit scalar types. Requires a compatible shader model and HLSL version."
        },
        "spirv": {
          "type": "boolean",
          "default": false,
          "description": "Allow SPIR-V syntax and compilation behavior for HLSL."
        }
      }
    }
  },
  "$defs": {
    "defines": {
      "type": "object",
      "additionalProperties": { "type": "string" },
      "description": "Preprocessor symbols for this stage."
    }
  }
}
